{
  "$schema": "https://json-schema.org/draft/2020-12/schema",
  "$id": "https://github.com/durable-workflow/.github/blob/main/beta-authorization/evidence-schema.json",
  "title": "Durable Workflow beta authorization evidence",
  "type": "object",
  "additionalProperties": false,
  "required": [
    "schema",
    "authorization_sha256",
    "request_sha256",
    "decision",
    "candidate",
    "qualification",
    "conformance",
    "continuity",
    "backlog",
    "github_authority"
  ],
  "properties": {
    "schema": { "const": "durable-workflow.beta-authorization-evidence/v1" },
    "authorization_sha256": { "$ref": "#/$defs/sha256" },
    "request_sha256": { "$ref": "#/$defs/sha256" },
    "decision": {
      "type": "object",
      "additionalProperties": false,
      "required": ["repository", "issue", "issue_url", "comment", "comment_url", "author", "body_sha256"],
      "properties": {
        "repository": { "const": "durable-workflow/.github" },
        "issue": { "const": 3 },
        "issue_url": { "const": "https://github.com/durable-workflow/.github/issues/3" },
        "comment": { "type": "integer", "minimum": 1 },
        "comment_url": { "type": "string", "pattern": "^https://github.com/durable-workflow/\\.github/issues/3#issuecomment-" },
        "author": { "$ref": "#/$defs/user" },
        "body_sha256": { "$ref": "#/$defs/sha256" }
      }
    },
    "candidate": {
      "type": "object",
      "additionalProperties": false,
      "required": ["tag", "commit", "manifest_sha256", "verification_sha256"],
      "properties": {
        "tag": { "type": "string", "pattern": "^beta-candidate/" },
        "commit": { "$ref": "#/$defs/commit" },
        "manifest_sha256": { "$ref": "#/$defs/sha256" },
        "verification_sha256": { "$ref": "#/$defs/sha256" }
      }
    },
    "qualification": {
      "type": "object",
      "additionalProperties": false,
      "required": ["path", "sha256"],
      "properties": {
        "path": { "const": "target-qualification-evidence.json" },
        "sha256": { "$ref": "#/$defs/sha256" }
      }
    },
    "conformance": {
      "type": "object",
      "additionalProperties": false,
      "required": ["tag", "commit", "release", "run"],
      "properties": {
        "tag": { "type": "string", "pattern": "^beta-conformance/" },
        "commit": { "$ref": "#/$defs/commit" },
        "release": { "type": "string", "pattern": "^https://github.com/durable-workflow/\\.github/releases/tag/" },
        "run": {
          "type": "object",
          "additionalProperties": false,
          "required": ["repository", "run_id", "run_attempt", "evidence_tag"],
          "properties": {
            "repository": { "const": "durable-workflow/.github" },
            "run_id": { "type": "integer", "minimum": 1 },
            "run_attempt": { "type": "integer", "minimum": 1 },
            "evidence_tag": { "type": "string", "pattern": "^beta-conformance/" }
          }
        }
      }
    },
    "continuity": {
      "type": "object",
      "additionalProperties": false,
      "required": ["complete", "no_op", "plan"],
      "properties": {
        "complete": { "$ref": "#/$defs/gitRecord" },
        "no_op": { "$ref": "#/$defs/gitRecord" },
        "plan": { "$ref": "#/$defs/digestRecord" }
      }
    },
    "backlog": {
      "type": "object",
      "additionalProperties": false,
      "required": ["repositories", "allowed_authorization_gate", "unresolved_p0_p1"],
      "properties": {
        "repositories": {
          "type": "array",
          "minItems": 1,
          "uniqueItems": true,
          "items": { "type": "string", "pattern": "^durable-workflow/" }
        },
        "allowed_authorization_gate": {
          "type": "object",
          "additionalProperties": false,
          "required": ["repository", "number", "url"],
          "properties": {
            "repository": { "const": "durable-workflow/.github" },
            "number": { "const": 3 },
            "url": { "const": "https://github.com/durable-workflow/.github/issues/3" }
          }
        },
        "unresolved_p0_p1": { "type": "array", "maxItems": 0 }
      }
    },
    "github_authority": {
      "type": "object",
      "additionalProperties": false,
      "required": [
        "actor",
        "repository",
        "workflow_ref",
        "workflow_commit",
        "run_id",
        "run_attempt",
        "run_url",
        "environment",
        "environment_protection",
        "environment_approval"
      ],
      "properties": {
        "actor": { "type": "string", "pattern": "^[A-Za-z0-9-]{1,39}$" },
        "repository": { "const": "durable-workflow/.github" },
        "workflow_ref": { "const": "durable-workflow/.github/.github/workflows/beta-authorization.yml@refs/heads/main" },
        "workflow_commit": { "$ref": "#/$defs/commit" },
        "run_id": { "type": "integer", "minimum": 1 },
        "run_attempt": { "type": "integer", "minimum": 1 },
        "run_url": { "type": "string", "pattern": "^https://github.com/durable-workflow/\\.github/actions/runs/" },
        "environment": { "const": "beta-authorization" },
        "environment_protection": { "$ref": "#/$defs/environmentProtection" },
        "environment_approval": { "$ref": "#/$defs/environmentApproval" }
      }
    }
  },
  "$defs": {
    "commit": { "type": "string", "pattern": "^[0-9a-f]{40}$" },
    "sha256": { "type": "string", "pattern": "^[0-9a-f]{64}$" },
    "gitRecord": {
      "type": "object",
      "additionalProperties": false,
      "required": ["tag", "commit"],
      "properties": {
        "tag": { "type": "string", "minLength": 1 },
        "commit": { "$ref": "#/$defs/commit" }
      }
    },
    "digestRecord": {
      "type": "object",
      "additionalProperties": false,
      "required": ["tag", "commit", "sha256"],
      "properties": {
        "tag": { "type": "string", "minLength": 1 },
        "commit": { "$ref": "#/$defs/commit" },
        "sha256": { "$ref": "#/$defs/sha256" }
      }
    },
    "user": {
      "type": "object",
      "additionalProperties": false,
      "required": ["login", "id", "node_id", "url", "html_url"],
      "properties": {
        "login": { "type": "string", "pattern": "^[A-Za-z0-9-]{1,39}$" },
        "id": { "type": "integer", "minimum": 1 },
        "node_id": { "type": "string", "minLength": 1 },
        "url": { "type": "string", "pattern": "^https://api.github.com/users/" },
        "html_url": { "type": "string", "pattern": "^https://github.com/" }
      }
    },
    "environmentProtection": {
      "type": "object",
      "additionalProperties": false,
      "required": [
        "custom_branch_policies",
        "deployment_branch_policy",
        "environment_id",
        "environment_url",
        "prevent_self_review",
        "required_reviewer_rule_ids",
        "required_reviewer_user_ids"
      ],
      "properties": {
        "custom_branch_policies": {
          "type": "array",
          "minItems": 1,
          "maxItems": 1,
          "items": {
            "type": "object",
            "additionalProperties": false,
            "required": ["id", "name"],
            "properties": {
              "id": { "type": "integer", "minimum": 1 },
              "name": { "const": "main" }
            }
          }
        },
        "deployment_branch_policy": {
          "const": { "custom_branch_policies": true, "protected_branches": false }
        },
        "environment_id": { "type": "integer", "minimum": 1 },
        "environment_url": {
          "const": "https://github.com/durable-workflow/.github/deployments/activity_log?environments_filter=beta-authorization"
        },
        "prevent_self_review": { "const": false },
        "required_reviewer_rule_ids": {
          "type": "array",
          "minItems": 1,
          "uniqueItems": true,
          "items": { "type": "integer", "minimum": 1 }
        },
        "required_reviewer_user_ids": { "const": [1130888] }
      }
    },
    "environmentApproval": {
      "type": "object",
      "additionalProperties": false,
      "required": ["comment", "environments", "run_attempt", "run_id", "state", "user"],
      "properties": {
        "comment": { "type": "string" },
        "environments": {
          "type": "array",
          "minItems": 1,
          "maxItems": 1,
          "items": {
            "type": "object",
            "additionalProperties": false,
            "required": ["html_url", "id", "name", "node_id", "url"],
            "properties": {
              "html_url": {
                "const": "https://github.com/durable-workflow/.github/deployments/activity_log?environments_filter=beta-authorization"
              },
              "id": { "type": "integer", "minimum": 1 },
              "name": { "const": "beta-authorization" },
              "node_id": { "type": "string", "minLength": 1 },
              "url": {
                "const": "https://api.github.com/repos/durable-workflow/.github/environments/beta-authorization"
              }
            }
          }
        },
        "run_attempt": { "type": "integer", "minimum": 1 },
        "run_id": { "type": "integer", "minimum": 1 },
        "state": { "const": "approved" },
        "user": {
          "allOf": [
            { "$ref": "#/$defs/user" },
            {
              "type": "object",
              "properties": {
                "id": { "const": 1130888 }
              }
            }
          ]
        }
      }
    }
  }
}
